{
  "schemaVersion": 1,
  "artifactType": "debug-result",
  "skill": "debug-flow",
  "skillVersion": "0.1.0",
  "runId": "demo-line-drawer-debug-001",
  "flowId": "demo-line-drawer",
  "status": "repaired",
  "flowContract": {
    "path": "examples\\handoff\\demo-line-drawer\\flow-contract.json",
    "sha256": "f3e564f84c4667b750d05137a210ac522f8c18871237788b9061cbe5a1fe3d8b"
  },
  "migrationResult": {
    "path": "examples\\handoff\\demo-line-drawer\\migration-result.json",
    "sha256": "e699642e952dc1319c114d443ea2ed8d7460f7a8571c2938e64ffb6f73e67d39"
  },
  "verificationResult": {
    "path": "examples\\debug\\demo-line-drawer\\failed-verification-result.json",
    "sha256": "c9e0ca61648d502b6a6716e0cf7621730c1597f00939de3b315d1b4f418710df"
  },
  "debugHandoff": {
    "path": "examples\\debug\\demo-line-drawer\\debug-handoff.json",
    "sha256": "3543fd53bca674fd5b22ba8069d7235f1e19047fe4d4985bd7eee3a7302ce9d5"
  },
  "repository": {
    "root": "C:\\Example\\frontend",
    "revisionBefore": "0123456789abcdef0123456789abcdef01234567",
    "revisionAfter": "fedcba9876543210fedcba9876543210fedcba98"
  },
  "selectedStartTier": "immediate",
  "selectionReason": "The root cause was local, confirmed and covered by a targeted reproduction.",
  "attempts": [
    {
      "tier": "immediate",
      "status": "repaired",
      "hypothesis": "The drawer omitted its local display refresh after the accepted update.",
      "reproductionEvidence": [
        "The targeted stale-length assertion failed before the fix and passed after it."
      ],
      "changedPaths": [
        "src/features/demo-line-drawer/Drawer.ts"
      ],
      "validation": [
        {
          "command": "npm run test -- Drawer.test.ts",
          "status": "passed",
          "summary": "The targeted reproduction passed after the repair."
        },
        {
          "command": "npm run typecheck",
          "status": "passed",
          "summary": "Typecheck passed."
        },
        {
          "command": "npm run build",
          "status": "passed",
          "summary": "Build passed."
        }
      ],
      "checkpoint": {
        "commitSha": "1234567890abcdef1234567890abcdef12345678",
        "subject": "TP522512: refresh detail drawer after line update",
        "paths": [
          "src/features/demo-line-drawer/Drawer.ts"
        ],
        "stagedDiffSha256": "0123456789abcdef0123456789abcdef0123456789abcdef0123456789abcdef"
      },
      "summary": "The local stale display was repaired in one immediate attempt."
    }
  ],
  "nextAction": "reverify",
  "limitations": [
    "The repair is not a PASS until a fresh independent verify-flow run succeeds."
  ]
}
